autor/proyecto;descripciÛn;valido;tipo;lnguaje;extra;;;;;;;;;;;;;;;;;;;;;;;;;;;;;;;;;;;;;;;;;;;;;;;;;;;;;;;
obsidiansystems/obelisk;Functional reactive web and mobile applications, with batteries included.;no;ide;;es una aplicaciÛn/entorno que sirve para crear aplicaciones moviles reactivas;;;;;;;;;;;;;;;;;;;;;;;;;;;;;;;;;;;;;;;;;;;;;;;;;;;;;;;
apache/cordova-plugin-battery-status;Apache Cordova Battery Status Plugin;si;app plugin;java 100%;Este plugin sirve para conocer el status de la bateria;https://cordova.apache.org/docs/en/9.x/reference/cordova-plugin-battery-status/;;;;;;;;;;;;;;;;;;;;;;;;;;;;;;;;;;;;;;;;;;;;;;;;;;;;;;
tobykurien/BatteryFu;BatteryFu (pronounced Battery-Foo, like in Kung-Fu) is an Android app that extends battery life (and lowers data usage) by changing always-on mobile/wifi data to periodic sync (meaning it disables your mobile data and/or Wifi, then checks your accounts every X minutes).;si;app;java 100%;; ;;;;;;;;;;;;;;;;;;;;;;;;;;;;;;;;;;;;;;;;;;;;;;;;;;;;;;
nuxt-modules/ionic;Batteries-included, zero-config Ionic integration for Nuxt;no;enviroment;;;;;;;;;;;;;;;;;;;;;;;;;;;;;;;;;;;;;;;;;;;;;;;;;;;;;;;;;
intelligems/django-mobile-app;A batteries-included mobile app backend in Django;no;app;;;;;;;;;;;;;;;;;;;;;;;;;;;;;;;;;;;;;;;;;;;;;;;;;;;;;;;;;
smart-test-ti/SoloX;üíØSoloX - Real-time collection tool for Android/iOS performance data.ÔºàAndroidÊÄßËÉΩÊµãËØïandroid performance\iOSÊÄßËÉΩÊµãËØïios performance\ÁßªÂä®Á´ØÊÄßËÉΩÊµãËØïmobile performance\APPÊÄßËÉΩÊµãËØïapp performance\appÊÄßËÉΩÊµãËØïÂ∑•ÂÖ∑Ôºâ;-;app;;app for smartphone app testing;;;;;;;;;;;;;;;;;;;;;;;;;;;;;;;;;;;;;;;;;;;;;;;;;;;;;;;
marmelab/battery-friendly-timer;Mobile applications using setInterval to poll a server are a battery hogs. Save battery life by fetching data at the right moment.;yes;;;alert;;;;;;;;;;;;;;;;;;;;;;;;;;;;;;;;;;;;;;;;;;;;;;;;;;;;;;;
NileshSP/FlutterBatteryNotifyer;Cross mobile platform (ios/android) battery charging notification alert app built using Flutter;yes;;;alert;;;;;;;;;;;;;;;;;;;;;;;;;;;;;;;;;;;;;;;;;;;;;;;;;;;;;;;
JatinSadhwani02/Mobile-Price-Prediction-using-ML-Algorithm;I have implemented a Mobile Price Prediction using different Machine Learning Algorithms. This project will classify the price range of the mobile price. The price ranges from 0-3. We‚Äôll discuss the price range in the dataset. Now I have trained a mobile price classification using 3 ML algorithms. This model classifies the range of the mobile based on the different parameters like from camera, touch screen, cores, battery, clock speed, internal memory, battery capacity, etc. After training the model using 3 algorithms, I compared all the models using the graph.;no;;;mobile price;;;;;;;;;;;;;;;;;;;;;;;;;;;;;;;;;;;;;;;;;;;;;;;;;;;;;;;
duluca/angular1.5-starter;A batteries-included Mobile-First Angular 1.5+ and Angular Material Seed Project;no;;;batteries included;;;;;;;;;;;;;;;;;;;;;;;;;;;;;;;;;;;;;;;;;;;;;;;;;;;;;;;
JohannesMilke/battery_example;Detect the current battery level and battery state of your phone in Flutter and also detect if your phone is currently charging.;si;;flutter;alert;battery check;;;;;;;;;;;;;;;;;;;;;;;;;;;;;;;;;;;;;;;;;;;;;;;;;;;;;;
renanwolf/UniRate;Unity plugin to easily manage the application frame rate and rendering interval. Reducing battery power consumption and device heat, especially on mobile platforms.;-;;C#;;;;;;;;;;;;;;;;;;;;;;;;;;;;;;;;;;;;;;;;;;;;;;;;;;;;;;;;
r-plus/BatteryTrace;iOS battery logger to ~mobile/battery.txt;no;;logos;;battery tracker;;;;;;;;;;;;;;;;;;;;;;;;;;;;;;;;;;;;;;;;;;;;;;;;;;;;;;
219-design/qt-qml-project-template-with-ci;Template for a Qt/QML application with batteries included: GitHub C.I. for your QML app;no;;;batteries included;;;;;;;;;;;;;;;;;;;;;;;;;;;;;;;;;;;;;;;;;;;;;;;;;;;;;;;
AndreiDuma/arch-battery;Battery status utility for Fujitsu Esprimo Mobile v6555 & Arch Linux.;no;;;;;;;;;;;;;;;;;;;;;;;;;;;;;;;;;;;;;;;;;;;;;;;;;;;;;;;;;;
thesarthakjain/telegram_bot;This is a personal telegram bot. Hosted locally on a 'Raspberry Pi 4 Model-B 4GB' and an 'Android Mobile Device' (for battery backup).;no;;;interesting but not what i like;;;;;;;;;;;;;;;;;;;;;;;;;;;;;;;;;;;;;;;;;;;;;;;;;;;;;;;
myTerminal/power-guard;A battery protector for mobile computers;si;;;good battery saving tool, but for computer;;;;;;;;;;;;;;;;;;;;;;;;;;;;;;;;;;;;;;;;;;;;;;;;;;;;;;;
ZenBarrier/wear-battery-full;Contains the entire source and art for the mobile and wear modules of the Wear Battery Full app.;no;;;watch battery tracker;;;;;;;;;;;;;;;;;;;;;;;;;;;;;;;;;;;;;;;;;;;;;;;;;;;;;;;
flicksoftdev/mobile_battery;;si;;;battery check design;;;;;;;;;;;;;;;;;;;;;;;;;;;;;;;;;;;;;;;;;;;;;;;;;;;;;;;
GSMATerminals/Battery-Life-Measurement-Test-Files-Public;TS.09 describes a selection of basic measurements that are representative of the main uses of mobile equipment (MS/UE) with a view that the resulting figures can provide a measure of battery performance or current consumption or current consumption whilst being exercised by a specific technology within a specified parameter set. This GitHub repository is for the storage of the test files used in TS.09. A copy of TS.09 can be obtained from the GSMA website here:- http://www.gsma.com/newsroom/gsmadocuments/;si;;;;;;;;;;;;;;;;;;;;;;;;;;;;;;;;;;;;;;;;;;;;;;;;;;;;;;;;;;
OGBENI-NG/battery;mobile battery Animation;no;;animation;;;;;;;;;;;;;;;;;;;;;;;;;;;;;;;;;;;;;;;;;;;;;;;;;;;;;;;;
sorah/bmwifiInfo;Show battery status, signal level, carrer name, status and connectivity type of B-mobile wifi (MF30, Japan Communications Inc.) ;no;;;;;;;;;;;;;;;;;;;;;;;;;;;;;;;;;;;;;;;;;;;;;;;;;;;;;;;;;;
kakshak07/Battery-Usage-and-Sleep-Pattern-Detection;Through this project, our main motive is to design an intelligent method through which the device (a mobile in this case) can predict on its own the user sleep pattern. When would the user sleep or just stop using his phone and hence from these idle hours, one could predict the most suitable time for charging the device. So the main concern of this project was first to get hold of data acquired, from different users, that would help us figure out the exact time slabs in which the users did not use their phone. ;si;;sleep pattern prediction for charge;;;;;;;;;;;;;;;;;;;;;;;;;;;;;;;;;;;;;;;;;;;;;;;;;;;;;;;;
hwclass/react-battery;React component for tracking the battery status of your computer or mobile device;no;;react;;;;;;;;;;;;;;;;;;;;;;;;;;;;;;;;;;;;;;;;;;;;;;;;;;;;;;;;
restujulian/BatteryBroadcast;"Matakuliah ""Pemrograman Java Mobile""";si;;react;battery tracker;;;;;;;;;;;;;;;;;;;;;;;;;;;;;;;;;;;;;;;;;;;;;;;;;;;;;;;
andi8301/BatteryStatus;Program Aplikasi Mobile;si;;java%100;battery tracker;;;;;;;;;;;;;;;;;;;;;;;;;;;;;;;;;;;;;;;;;;;;;;;;;;;;;;;
Andr3as/MobileBattery;EXPERIMENT: Monitor your mobile battery level in the tray of your pc  -;no;;;;;;;;;;;;;;;;;;;;;;;;;;;;;;;;;;;;;;;;;;;;;;;;;;;;;;;;;;
archanakp/MobileBattery;;-;;;no hay descripciÛn;;;;;;;;;;;;;;;;;;;;;;;;;;;;;;;;;;;;;;;;;;;;;;;;;;;;;;;
ziloka/BatteryTrackerMobileApp;;no;;;repositorio vacio;;;;;;;;;;;;;;;;;;;;;;;;;;;;;;;;;;;;;;;;;;;;;;;;;;;;;;;
draga79/NotiMail;Server-side email notification manager using several push providers for real-time alerts. Conserve mobile battery without compromising on immediacy.;yes;software;python;manejo de mensajes;;;;;;;;;;;;;;;;;;;;;;;;;;;;;;;;;;;;;;;;;;;;;;;;;;;;;;;
jaminNZx/ESP8266-Power-Monitor;An Arduino sketch to connect an INA-219 module to an ESP dev board and measure Voltage, Current, Power, Energy Consumption and Costs via the Blynk mobile app.;no;;;;;;;;;;;;;;;;;;;;;;;;;;;;;;;;;;;;;;;;;;;;;;;;;;;;;;;;;;
swissembedded/em;Usefull application for control (e.g. optimise self consumption) and monitor electrical power grid devices such as photovoltaic plants, energy storage, e-mobile charger;maybe;app;css,java,html;manejo de electrical devices, could be a tool to control charging;;;;;;;;;;;;;;;;;;;;;;;;;;;;;;;;;;;;;;;;;;;;;;;;;;;;;;;
tassdr/framework-energy-consumption;An analysis of front-end frameworks, for the purpose of evaluation in regards to their energy consumption from the point of view of software developers, in the context of mobile development.;yes;analysis;python;fronend consumption;;;;;;;;;;;;;;;;;;;;;;;;;;;;;;;;;;;;;;;;;;;;;;;;;;;;;;;
Zhao-Wilson/Energy-aware-compute-strategy;The growth of data volume and the popularity of mobile devices have spawned a large number of low-latency, high-computing applications. At the same time, under the wave of global new energy, the energy efficiency utilization of electronic equipment has also received more and more attention. Due to a large delay and occupying the large bandwidth of cloud computing, and the limited computing power of end devices, mobile edge computing is considered to be the best way to achieve low latency of complex tasks. Wifi routers can provide high bandwidth and can work as intermediate nodes for forwarding tasks. In this report, we propose to use dynamic programming based on wifi routers to dynamically schedule computing tasks to edge computing nodes to achieve maximum bandwidth utilization, under the energy consumption constraint of the user. The experiment result shows that the DP method compared the with other three traditional algorithms can get higher bandwidth by using less Energy cost and fewer numbers workers. Besides, we can effectively search for the last phase Table to save much time by using Computation Reusability.;maybe;analysis;python;dinamically scheduled wifi connection;;;;;;;;;;;;;;;;;;;;;;;;;;;;;;;;;;;;;;;;;;;;;;;;;;;;;;;
EnergyVideoconfApps/MOBILESoft22;"Replication package of the study ""Do You Have the Energy for This Meeting? An Empirical Study on the Energy Consumption of Android Videoconferencing Apps""";maybe;analysis;python;"aplicaciÛn del estudio ""do i have energy for this meeting""";;;;;;;;;;;;;;;;;;;;;;;;;;;;;;;;;;;;;;;;;;;;;;;;;;;;;;;
mpalaourg/Thesis;Data Collection and Analysis of Energy Consumption of Mobile Phones using Machine Learning Techniques;yes;;java,python;nonlineal battery prediction;;;;;;;;;;;;;;;;;;;;;;;;;;;;;;;;;;;;;;;;;;;;;;;;;;;;;;;
Blacksej/energy_consumption_mobile_app;;no ;;vacio;vacio;;;;;;;;;;;;;;;;;;;;;;;;;;;;;;;;;;;;;;;;;;;;;;;;;;;;;;;
S2-group/mobilesoft-2020-caching-pwa-replication-package;"Replication package of the paper titled ""Evaluating the Impact of Caching on the Energy Consumption and Performance of Progressive Web Apps"" published at MOBILESoft 2020";maybe;analysis;python,javascript,html;;;;;;;;;;;;;;;;;;;;;;;;;;;;;;;;;;;;;;;;;;;;;;;;;;;;;;;;
sanjuwdr/energy-tracker;The Arduino based Electricity Measurement is a non-invasive method to track real-time tracking of usage through mobile apps provided and a web server which is accessible by authenticated users. Tracking of energy consumption on a monthly basis has been the traditionally employed strategy. Considering maximum optimization of power this application is intended on real time tracking of energy consumption. Connecting Arduino with electric energy meter and taking digital input seems a good and reliable hardware fit. Current is measured using split core current transformers. This data is then transmitted over a mobile data connection to the web interface which can be accessed by access privileged users. The project aims to provide a clear picture of a home‚Äôs current usage through a simple mobile application, and through this data provide an estimate to power consumption. The goal of provided such data to a user is that they will optimize and reduce their power usage. ;no;;;;;;;;;;;;;;;;;;;;;;;;;;;;;;;;;;;;;;;;;;;;;;;;;;;;;;;;;;
HiMinds/himinds-iot-project-mobile-home-energy-monitor-app;React Native and Expo app to visualise the power consumption on the three different phases i.e. L1, L2 and L3.;no;;;;;;;;;;;;;;;;;;;;;;;;;;;;;;;;;;;;;;;;;;;;;;;;;;;;;;;;;;
jphpsf/energy-watch;Electricity consumption watching app built on top of jQuery mobile;no;;javascript;energy watch;;;;;;;;;;;;;;;;;;;;;;;;;;;;;;;;;;;;;;;;;;;;;;;;;;;;;;;
vald3nir/Smart-Energy-Android;A mobile app for tracking home energy consumption;no;;;;;;;;;;;;;;;;;;;;;;;;;;;;;;;;;;;;;;;;;;;;;;;;;;;;;;;;;;
IsaGuclu/PredictionOfEnergy;Energy Consumption Prediction of Ontology Reasoning over Mobile Devices;no;;web ontology prediction;energy prediction;;;;;;;;;;;;;;;;;;;;;;;;;;;;;;;;;;;;;;;;;;;;;;;;;;;;;;;
romdhanmelek/Remote-monitoring-of-domestic-energy-consumption;Developing a mobile application to remote monitoring of domestic energy consumption using IoT;no;;C++;remote energy checking for IoT;;;;;;;;;;;;;;;;;;;;;;;;;;;;;;;;;;;;;;;;;;;;;;;;;;;;;;;
brettdh/libpowertutor;Programmatic prediction of network/CPU energy consumption for mobile phones.;no;;C++,jave;prediction of energy components in mobile phones;;;;;;;;;;;;;;;;;;;;;;;;;;;;;;;;;;;;;;;;;;;;;;;;;;;;;;;
moar82/EARMO;Wiki on how to use EARMO command-line application to improve design and energy consumption of mobile apps;no;;;;;;;;;;;;;;;;;;;;;;;;;;;;;;;;;;;;;;;;;;;;;;;;;;;;;;;;;;
wizardoz29/Cords-Mobile;IoT - Edge platform for industry 4.0 smart scheduling and monitoring. Monitor and control your energy consumptions, improve energy efficiency and utilization;no;;;incomplete idea;;;;;;;;;;;;;;;;;;;;;;;;;;;;;;;;;;;;;;;;;;;;;;;;;;;;;;;
gianpaolosinatra/ITS_ICT_leaf.xd-mobileApp-concept;Concept of a home automation mobile app that manages the people of a family, energy consumption, and appliances;no;;vacio;vacio;;;;;;;;;;;;;;;;;;;;;;;;;;;;;;;;;;;;;;;;;;;;;;;;;;;;;;;
wizardoz29/Cords-Mobile-App;IoT - Edge platform for industry 4.0 smart scheduling and monitoring. Monitor and control your energy consumptions, improve energy efficiency and utilization.;no;;;incomplete idea;;;;;;;;;;;;;;;;;;;;;;;;;;;;;;;;;;;;;;;;;;;;;;;;;;;;;;;
S2-group/EASE-2022-energy-critical-css-rep-pkg;EASE 2022 - On the Impact of the Critical CSS Technique on the Performance and Energy Consumption of Mobile Browsers;;;;;;;;;;;;;;;;;;;;;;;;;;;;;;;;;;;;;;;;;;;;;;;;;;;;;;;;;;;
thedammyking/energy-monitor;This was built for a NodeMCU device. Its is a mobile app built with React Native that measures energy consumption in a home.;;;;;;;;;;;;;;;;;;;;;;;;;;;;;;;;;;;;;;;;;;;;;;;;;;;;;;;;;;;
diptichaudhari24/Energy-Management-in-Mobile-Devices;Smart devices like smartphones, tablets, ipads are emerging with impressive functionality like gesture recognition, voice recognition, data transfer. Various kind of sensors like image sensors, voice sensors enable them to think critically and advance the artificial intelligence. Main concern for these devices is the energy consumption. Battery is drained excessively due to background activities like email syncing, continuous network management, GPS sensing and many more. Hence researchers are trying to optimize this energy consumption. This study comprises of such researches done in following topics: Optimal configuration for energy efficient functioning of inbuilt camera  Hotword detection using AccelWord(eg: Siri and OK Google)  Optimization techniques for Location Sensing(eg:CAPS, aLoc) Network traffic management We show some configural changes and some hardware replacement for minimal energy usage. We also show the experimental analytics in each case how the energy usage can be dropped up to 50-70%.;;;;;;;;;;;;;;;;;;;;;;;;;;;;;;;;;;;;;;;;;;;;;;;;;;;;;;;;;;;
guillainbisimwa/zaio-energy-saver;Reduce the power consumption and cost through newly designed Energy Saver Mobile App by CMARIX TechnoLabs and implemented in React Native;;;;;;;;;;;;;;;;;;;;;;;;;;;;;;;;;;;;;;;;;;;;;;;;;;;;;;;;;;;
ke-noel/electromunch;Mobile app to reduce phantom energy consumption in our homes when we're not there.;;;;;;;;;;;;;;;;;;;;;;;;;;;;;;;;;;;;;;;;;;;;;;;;;;;;;;;;;;;
S2-group/ease-2020-replication-package;"Replication package of the paper titled ""Investigating the correlation between performance scores and energy consumption of mobile web apps"" published at EASE 2020";;;;;;;;;;;;;;;;;;;;;;;;;;;;;;;;;;;;;;;;;;;;;;;;;;;;;;;;;;;
Alnidawi/EARLY-ANALYSIS-OF-SOFTWARE-ARCHITECTURE-TO-ESTIMATE-ENERGY-CONSUMPTION-IN-ANDROID-PLATFORM;This work presents the energy consumption analysis of DRS. An effective application designed to be used in Android smartphones to execute primitives operations especially: retrieving data from applied database, storing and measuring the energy consumption. This application builds by two different architectures (Server and Mobile-centric) in order to identify the least energy-consuming architecture for this kind of applications.;;;;;;;;;;;;;;;;;;;;;;;;;;;;;;;;;;;;;;;;;;;;;;;;;;;;;;;;;;;
Kadirvelan/IOT-energy-Monitor;Smart energy monitoring system technique tracks the usage of energy. Smart power meter provides data for optimization and reduce the power consumption. The electricity consumption can be observed by the user through a user-friendly mobile app called Blynk that uses cloud to store and retrieve data. As the results can be observed through the mobile application, the user can get some idea of saving and reducing electricity than earlier.;;;;;;;;;;;;;;;;;;;;;;;;;;;;;;;;;;;;;;;;;;;;;;;;;;;;;;;;;;;
SatishKumarAnbalagan/Energy-and-Performance-Aware-Task-Scheduling-in-a-Mobile-Cloud-Computing-Environment;Linear time recursive algorithm, that schedules task among the local cores or between the local cores and the cloud with optimization for minimal-delay and energy consumption by the mobile device.;;;;;;;;;;;;;;;;;;;;;;;;;;;;;;;;;;;;;;;;;;;;;;;;;;;;;;;;;;;
nishthachawla08/Mobile-Applications;"Energy consumption is an important quality parameter and it impacts the usability of the mobile app. I have performed a Literature Review to study, review and analyze numerous energy optimization techniques for the mobile apps. Also, I have attached the slide deck for the paper which I presented to my entire class and led the discussion on - "" Automated Energy Optimization of HTTP Requests for Mobile Applications"".";;;;;;;;;;;;;;;;;;;;;;;;;;;;;;;;;;;;;;;;;;;;;;;;;;;;;;;;;;;
google/battery-historian;"Battery Historian is a tool to analyze battery consumers using Android ""bugreport"" files.";;;;;;;;;;;;;;;;;;;;;;;;;;;;;;;;;;;;;;;;;;;;;;;;;;;;;;;;;;;
asksven/BetterBatteryStats;An attempt to provide advanced battery stats for Android;;;;;;;;;;;;;;;;;;;;;;;;;;;;;;;;;;;;;;;;;;;;;;;;;;;;;;;;;;;
0x192/universal-android-debloater;Cross-platform GUI written in Rust using ADB to debloat non-rooted android devices. Improve your privacy, the security and battery life of your device.;;;;;;;;;;;;;;;;;;;;;;;;;;;;;;;;;;;;;;;;;;;;;;;;;;;;;;;;;;;
wearscript/wearscript-android;JavaScript with Batteries Included for Google Glass;;;;;;;;;;;;;;;;;;;;;;;;;;;;;;;;;;;;;;;;;;;;;;;;;;;;;;;;;;;
er-mo/Android-Battery-Widget;Battery widget indicator for android;;;;;;;;;;;;;;;;;;;;;;;;;;;;;;;;;;;;;;;;;;;;;;;;;;;;;;;;;;;
Lyokone/flutterlocation;A Flutter plugin to easily handle realtime location in iOS and Android. Provides settings for optimizing performance or battery.;;;;;;;;;;;;;;;;;;;;;;;;;;;;;;;;;;;;;;;;;;;;;;;;;;;;;;;;;;;
greenhub-project/batteryhub;:seedling: Android battery monitor app;;;;;;;;;;;;;;;;;;;;;;;;;;;;;;;;;;;;;;;;;;;;;;;;;;;;;;;;;;;
darshan-/Battery-Indicator-Pro;BatteryBot Battery Indicator for Android;;;;;;;;;;;;;;;;;;;;;;;;;;;;;;;;;;;;;;;;;;;;;;;;;;;;;;;;;;;
rasheedk/react-native-disable-battery-optimizations-android;A react native library for checking battery optimization and whitelisting in Android;;;;;;;;;;;;;;;;;;;;;;;;;;;;;;;;;;;;;;;;;;;;;;;;;;;;;;;;;;;
rsteckler/unbounce-android;Take control of your battery life by limiting wakelocks and alarms;;;;;;;;;;;;;;;;;;;;;;;;;;;;;;;;;;;;;;;;;;;;;;;;;;;;;;;;;;;
BharathVishal/BatteryStats-for-Android;Displays all battery stats of an Android device using broadcast receiver. Fully implemented in Jetpack compose using Material You dynamic theming and also has a separate implementation in xml with MDC 3.;;;;;;;;;;;;;;;;;;;;;;;;;;;;;;;;;;;;;;;;;;;;;;;;;;;;;;;;;;;
dirkam/backgroundable-android;Collection of stock apps and mechanisms, which might affect background tasks and scheduled alarms.;;;;;;;;;;;;;;;;;;;;;;;;;;;;;;;;;;;;;;;;;;;;;;;;;;;;;;;;;;;
Domi04151309/BatteryTool;Battery Tool helps you save battery by stopping apps that are running in the background.;;;;;;;;;;;;;;;;;;;;;;;;;;;;;;;;;;;;;;;;;;;;;;;;;;;;;;;;;;;
transistorsoft/cordova-background-geolocation-lt;The most sophisticated background location-tracking & geofencing module with battery-conscious motion-detection intelligence for iOS and Android.;;;;;;;;;;;;;;;;;;;;;;;;;;;;;;;;;;;;;;;;;;;;;;;;;;;;;;;;;;;
eo/battery-meter-view;üîã Material design battery meter (i.e. level, state) view for Android;;;;;;;;;;;;;;;;;;;;;;;;;;;;;;;;;;;;;;;;;;;;;;;;;;;;;;;;;;;
ChenYXin/BatteryView;‰∏Ä‰∏™AndroidÂºÄÂèë‰∏≠ÂèØËÉΩ‰ºö‰ΩøÁî®Âà∞ÁîµÊ±†Êéß‰ª∂viewÔºåÊúâÊ∞¥Âπ≥ÂíåÂûÇÁõ¥‰∏§‰∏™ÊñπÂêëÔºåÂêåÊó∂Ê†πÊçÆÁîµÊ±†ÁîµÈáèÊõ¥ÊîπÁîµÊ±†‰∏≠ÁöÑÁîµÈáèÈ¢úËâ≤;;;;;;;;;;;;;;;;;;;;;;;;;;;;;;;;;;;;;;;;;;;;;;;;;;;;;;;;;;;
jineshfrancs/BatteryProgressView;Custom progress view to show progress with cool animation.;;;;;;;;;;;;;;;;;;;;;;;;;;;;;;;;;;;;;;;;;;;;;;;;;;;;;;;;;;;
pwittchen/RxBattery;monitors battery state of the Android device;;;;;;;;;;;;;;;;;;;;;;;;;;;;;;;;;;;;;;;;;;;;;;;;;;;;;;;;;;;
udacity/ud825-battery;Course code repository for Android Performance - Battery lesson;;;;;;;;;;;;;;;;;;;;;;;;;;;;;;;;;;;;;;;;;;;;;;;;;;;;;;;;;;;
pranaypatel512/AndroidLiveTemplates; :rocket: A curated android templates to make android development more easy and fast :battery: !;;;;;;;;;;;;;;;;;;;;;;;;;;;;;;;;;;;;;;;;;;;;;;;;;;;;;;;;;;;
fankes/TSBattery;A new way to save your battery avoid cancer apps hacker it.;;;;;;;;;;;;;;;;;;;;;;;;;;;;;;;;;;;;;;;;;;;;;;;;;;;;;;;;;;;
HuolalaTech/batteryfinder-android;A detection tool of Android App power consumption;;;;;;;;;;;;;;;;;;;;;;;;;;;;;;;;;;;;;;;;;;;;;;;;;;;;;;;;;;;
tytydraco/Buoy;An extension to the built in Android Battery Saver;;;;;;;;;;;;;;;;;;;;;;;;;;;;;;;;;;;;;;;;;;;;;;;;;;;;;;;;;;;
alanszlosek/android-accelerometer-gps;Track your movements in a way that doesn't drain your battery: offline, and with the accelerometer's help!;;;;;;;;;;;;;;;;;;;;;;;;;;;;;;;;;;;;;;;;;;;;;;;;;;;;;;;;;;;
jackvt93/Open-Battery-Saver;Open Battery Saver is an open source android application. It helps android devices reduce battery usage, gets a long time for life's battery. This also my productivity in a Summer's contest when I study at university;;;;;;;;;;;;;;;;;;;;;;;;;;;;;;;;;;;;;;;;;;;;;;;;;;;;;;;;;;;
artiomchi/Dual-Battery-Widget;Android widget showing the status of up to two batteries;;;;;;;;;;;;;;;;;;;;;;;;;;;;;;;;;;;;;;;;;;;;;;;;;;;;;;;;;;;
YungSpecht/Gasolina;Increase your Battery Life on iOS by safely reducing some system functions and enabling some power saving features.;;;;;;;;;;;;;;;;;;;;;;;;;;;;;;;;;;;;;;;;;;;;;;;;;;;;;;;;;;;
exiva/orangered_pusher;Push reddit orangered notifications to Windows 8, Windows Phone, iOS and Android devices saving battery from polling.;;;;;;;;;;;;;;;;;;;;;;;;;;;;;;;;;;;;;;;;;;;;;;;;;;;;;;;;;;;
